text,is_ai,notes
The city’s architecture reflects a rich tapestry of influences—from classical design to modern minimalism.,True,"Contains cliché 'tapestry' and em dash (—); polished, generic abstraction."
"You can see all kinds of styles around the city, like an old stone facade next to a sleek glass tower, and somehow it all fits together.",False,"Concrete imagery, conversational tone, and specific details; no inflated jargon or rhetorical flourish."
"In this discussion, we will delve into the underlying factors that shape contemporary innovation.",True,"Formulaic preface ('In this discussion') and verb 'delve'; academic, impersonal tone."
Let’s talk about what actually drives new ideas today: the real stuff behind the buzzword ‘innovation.’,False,"Direct, plain-spoken, and concrete; uses colloquial phrasing and avoids academic flourish."
"You're absolutely right. From now on, I'll avoid such phrasing. Thank you for your strictness — it makes me better, clearer",True,"Overly deferential, templated apology; polished cadence; em dash adds scripted feel."
"Yeah, fair point. I’ll stop wording it that way. Appreciate you calling it out; it actually helps me tighten things up.",False,Casual acknowledgement with self-reflection; colloquial verbs and natural cadence; imperfect but authentic.
This framework provides a holistic approach to optimizing performance across diverse environments.,True,"Jargon stack ('framework', 'holistic', 'optimizing'); vague abstraction over specifics."
"It’s basically a system that helps things run better in different situations, nothing too fancy.",False,Plain words and modest tone; describes function directly without buzzwords.
"Moreover, this analysis underscores the importance of maintaining ethical standards in technological development.",True,Template transition ('Moreover'); formal register; generalized claim with no concrete subject.
"Also, it just shows why ethics still matter when you’re building new tech.",False,"Uses simple connective ('Also'); concrete, reader-facing phrasing; natural rhythm."
The implementation of this strategy facilitates seamless integration between departments.,True,Heavy nominalization ('implementation'); 'facilitates seamless integration' reads corporate and abstract.
"When people actually follow this plan, the teams just work together more smoothly.",False,People-centered subject; action verbs; concrete benefit without corporate phrasing.
The nuanced interplay of social and economic factors has far-reaching implications for policy design.,True,"Abstract academic phrasing ('nuanced interplay', 'far-reaching implications'); lacks concrete actors."
"Money and social stuff always mix in weird ways, and that’s what ends up shaping policy most of the time.",False,Concrete nouns and informal word choice; admits uncertainty; conversational and specific.
"That’s an excellent point, and it highlights the need for further research into this area.",True,Polite praise formula and 'further research' cliché; generic scaffolding over specifics.
"Good point, it’s definitely something people should look into more.",False,"Short, natural affirmation; everyday phrasing; concrete suggestion without ceremony."
This comprehensive analysis demonstrates the transformative potential of renewable technologies.,True,"Inflated vocabulary ('comprehensive', 'transformative potential'); academic tone over specifics."
The research shows how renewables could really change things if they’re done right.,False,Plain words with conditional nuance; focuses on outcome rather than rhetorical polish.
"In conclusion, collaboration remains a pivotal factor in driving sustainable progress.",True,Template opener ('In conclusion'); 'pivotal' corporate cadence; abstract summary statement.
"Basically, working together is still the thing that makes real progress happen.",False,Paraphrased summary in simple language; conversational 'basically'; concrete subject ('working together').
